Field Name,Description,Data Type,Data Owner,Data Steward,Sensitivity
turbine_id,Unique alphanumeric identifier for each wind turbine asset.,String,Asset Mgmt,Asset Engineer,Internal
active_power_kw,Real-time power output generated by the turbine in kilowatts.,Float,Operations,Data Analyst,Internal
wind_speed_ms,Wind speed measured by the nacelle anemometer in meters per second.,Float,Operations,Data Analyst,Internal
blade_pitch_deg,The angle of the turbine blades relative to the wind direction.,Integer,Engineering,Systems Monitor,Restricted
last_service_date,The date of the most recent physical maintenance inspection.,Date,Maintenance,Field Lead,Internal
curtailment_flag,Indicates if the turbine is intentionally slowed to balance the grid (0/1).,Boolean,Grid Ops,Grid Liaison,Restricted